{
  "meta": {
    "spec_id": "audio_req_abandoned_temple",
    "level_id": "abandoned_temple",
    "version": "0.1.0",
    "owner": "level"
  },
  "context": {
    "intent": "废弃山寺音频设计——以极简环境音作为心理张力工具，有声即有信息（守护者的脚步/木鱼声 = 位置提示），刻意回避 BGM 对玩家专注力的干扰。Part 2 铃铛敲响是全场最强的音频事件。",
    "level_type": "poi"
  },
  "overall": "音频方向：「沉默即压迫，声音即信息」。Part 1 潜入段以环境底噪 + 守护者行动音效为主轴，不铺背景音乐（背景音乐会掩盖守护者位置提示）。Part 2 对峙段以铃铛共鸣触发急速配乐切换，形成 Part 1 的极端对比。所有环境音以 3D 空间音效设计，确保玩家能通过声音判断方向和距离。",
  "ambient_sounds": [
    {
      "region_id": "山门",
      "description": "山风穿过断裂石柱的低频呜鸣声（宽频 200-800Hz）+ 远处枯枝偶发摩擦碎裂声（随机间隔 20-45s）。风声方向性强，让玩家感受到「外部来风」，强化边界感。",
      "time_period": "夜间全程",
      "weather": "无雨天气为主（雨天加滴水声和雨打石板声，频率加密）",
      "source": "环境层 - 山门区域",
      "audible_range": "山门区域全域可闻，向前殿方向衰减",
      "frequency": "常驻低频；突发声随机 20-45s 间隔",
      "status": "pending"
    },
    {
      "region_id": "前殿",
      "description": "蜡烛燃烧的微弱噼啪声（极低频，需 3D 声使其有点位感）+ 守护者持灯笼游走的木地板吱嘎声（方向性强，玩家可据此判断守护者在哪一侧）+ 偶发木鱼声（守护者进入巡逻「祈祷模式」时节奏性响起，频率约 1Hz，持续 15-30s）。",
      "time_period": "夜间全程",
      "source": "点音源 - 各蜡烛位置；NPC 行走 foley",
      "audible_range": "蜡烛声 2m 内；木地板声 8m 内；木鱼声 15m 内",
      "frequency": "常驻基础声；守护者行为触发木鱼",
      "status": "pending"
    },
    {
      "region_id": "回廊",
      "description": "穿堂风形成有节律的低频空鸣（500-1200Hz），类似向瓶口吹气的声音但更宽阔。夜虫声（日本铃虫类）提供季节感底层，极低音量，不干扰主要信息。廊柱摩擦偶发轻微振动声（远处）。",
      "time_period": "夜间全程",
      "source": "环境层 - 回廊空间",
      "audible_range": "廊道内全域",
      "frequency": "常驻",
      "status": "pending"
    },
    {
      "region_id": "地下密室",
      "description": "完全密闭的低频本底音——近似「耳压感」的 40-80Hz 极低频振动（石碑共鸣的声学现象）。没有自然环境音，只有这种生理不适感的低频和玩家自身的脚步/呼吸声。玩家接触石碑时触发一次高频单音（4000Hz，0.1s，刺耳），随即消散。",
      "time_period": "进入密室全程",
      "weather": "不受天气影响",
      "source": "环境层 - 密室整体（低频）；石碑为点音源（触发音效）",
      "audible_range": "密室内全域",
      "frequency": "常驻",
      "status": "pending"
    },
    {
      "region_id": "钟楼",
      "description": "钟楼登楼后：首先是明显增强的风声（制高点，比地面更强）+ 远处山林的树叶摩擦声（形成「开阔感」对比）。铜钟本身的残余共鸣：玩家走近铜钟可以听到极低频的持续金属泛音（铜钟固有频率约 80Hz），提示「可交互」。",
      "time_period": "夜间全程",
      "source": "环境层 - 钟楼顶层；点音源 - 铜钟",
      "audible_range": "钟楼层全域；铜钟泛音 1.5m 内",
      "frequency": "常驻",
      "status": "pending"
    },
    {
      "region_id": "藏经阁",
      "description": "书页偶发翻动声（气流轻触），频率极低（随机 30-60s）。守护者路过时灯笼发出的烛台轻碰声 + 脚步声从走廊传入（3D 空间音效，可判断守护者在阁外走廊的位置）。总体极安静，背景本底近乎无声，强化「藏」和「窃听」感。",
      "time_period": "夜间全程",
      "source": "环境层 - 藏经阁空间；点音源 - 书页翻动",
      "audible_range": "阁内全域；走廊传入声 10m 内",
      "frequency": "书页翻动随机 30-60s 一次",
      "status": "pending"
    }
  ],
  "music": [
    {
      "scene_name": "Part 1 潜入段（无 BGM）",
      "mood_description": "意识决策：Part 1 全程不铺 BGM，以环境音 + NPC 音效传递张力。背景音乐介入会掩盖守护者脚步的位置信息，与关卡核心机制（听声辨位）冲突。玩家内心的恐惧来自「我不知道他在哪」而非音乐暗示——这是设计意图。",
      "duration_estimate": "约 20-30 min（Part 1 全程）",
      "status": "pending"
    },
    {
      "scene_name": "Part 2 铃铛触发 - 弱点窗口",
      "mood_description": "铜钟敲响瞬间：0.5s 的声音爆炸（铜钟全频共鸣，覆盖所有其他音源）→ 0.8s 后切入急促三弦/筝的刺破式旋律，与钟鸣尾音叠加。弱点窗口 8 秒内保持高张力节奏（120+ BPM），窗口结束前 2 秒旋律开始衰减，提示时限收束。守护者恢复后旋律陡然停止，回到寂静状态——对比落差极大，重建压迫感。",
      "duration_estimate": "8-10s / 次（每次铃铛触发）",
      "status": "pending"
    },
    {
      "scene_name": "Part 2 最终对峙收束",
      "mood_description": "累积三次弱点命中后的最终阶段：配乐从急促旋律渐变为沉重的太鼓低频节奏（60 BPM），伴随守护者最后的仪式状态瓦解过程（约 20s）。随后完全寂静 3 秒，过场切入。收束过场配乐：极简钢琴独奏（单一旋律，5 个音节），模糊地在「悲悯」和「解脱」之间。",
      "duration_estimate": "约 30s",
      "status": "pending"
    }
  ]
}
